{
  "coverageGaps": [
    {
      "cells": {
        "Description": "Re-verification on read is unspecified, so no row can cover it",
        "Mitigation": "Raised as FIND-001; a requirement is needed before a test",
        "Risk Level": "Low"
      },
      "id": "GAP-001",
      "line": 49
    }
  ],
  "id": "TM-000",
  "integrationMatrix": [
    {
      "id": "INT-001",
      "line": 43,
      "purpose": "Import writes through to the object store",
      "status": {
        "marker": "\u2705"
      },
      "target": "object-store",
      "testCases": "IT-001",
      "type": "service"
    }
  ],
  "provenance": {
    "digest": "sha256:65558d8c9defeb4117c42d1b376ee6d48a2247b5f6dc4fbd9d49a057b63a414a",
    "path": "skeletons/TestMatrixIndex.md"
  },
  "subsystemIndex": [
    {
      "line": 36,
      "localMatrix": "[import](./import/tests.md)",
      "requirements": "FR-001..FR-004",
      "status": {
        "marker": "\u2705",
        "note": "Complete"
      },
      "subsystem": "Import"
    },
    {
      "line": 37,
      "localMatrix": "[storage](./storage/tests.md)",
      "requirements": "FR-005..FR-009",
      "status": {
        "marker": "\ud83d\udea7",
        "note": "two criteria unbacked"
      },
      "subsystem": "Storage"
    }
  ],
  "title": "Example repository matrix index",
  "type": "TestMatrixIndex"
}
